{
  "$schema": "https://json-schema.org/draft/2020-12/schema",
  "$id": "https://proofrail.dev/schemas/v1/chain.schema.json",
  "title": "ProofRail canonical chain definition",
  "description": "Canonical machine definition produced from the user configuration. Runtime state and receipts are separate objects.",
  "type": "object",
  "additionalProperties": false,
  "required": ["schemaVersion", "chain", "tasks", "workspace"],
  "properties": {
    "schemaVersion": {
      "const": "1.0.0"
    },
    "chain": {
      "$ref": "#/$defs/chain"
    },
    "documentation": {
      "$ref": "#/$defs/documentation"
    },
    "tasks": {
      "type": "array",
      "minItems": 1,
      "items": {
        "$ref": "#/$defs/task"
      }
    },
    "workspace": {
      "$ref": "https://proofrail.dev/schemas/v1/workspace.schema.json"
    }
  },
  "$defs": {
    "id": {
      "type": "string",
      "minLength": 1,
      "maxLength": 64,
      "pattern": "^[a-z][a-z0-9]*(?:-[a-z0-9]+)*$"
    },
    "displayName": {
      "type": "string",
      "minLength": 1,
      "maxLength": 256
    },
    "idList": {
      "type": "array",
      "minItems": 1,
      "uniqueItems": true,
      "items": {
        "$ref": "#/$defs/id"
      }
    },
    "chain": {
      "type": "object",
      "additionalProperties": false,
      "required": ["id", "profile"],
      "properties": {
        "id": {
          "$ref": "#/$defs/id"
        },
        "name": {
          "$ref": "#/$defs/displayName"
        },
        "profile": {
          "enum": ["minimal", "standard", "strict"]
        }
      }
    },
    "documentation": {
      "type": "object",
      "additionalProperties": false,
      "required": ["policy"],
      "properties": {
        "policy": {
          "$ref": "#/$defs/documentationPolicy"
        },
        "impactRules": {
          "type": "array",
          "uniqueItems": true,
          "items": {
            "$ref": "#/$defs/impactRule"
          }
        }
      }
    },
    "documentationPolicy": {
      "enum": ["required", "if-affected", "optional", "forbidden"]
    },
    "impactRule": {
      "type": "object",
      "additionalProperties": false,
      "required": ["id", "whenTargetTags", "requireTargets", "requiredHooks"],
      "properties": {
        "id": {
          "$ref": "#/$defs/id"
        },
        "whenTargetTags": {
          "$ref": "#/$defs/idList"
        },
        "requireTargets": {
          "$ref": "#/$defs/idList"
        },
        "requiredHooks": {
          "$ref": "#/$defs/idList"
        }
      }
    },
    "task": {
      "type": "object",
      "additionalProperties": false,
      "required": ["id", "review", "steps"],
      "properties": {
        "id": {
          "$ref": "#/$defs/id"
        },
        "name": {
          "$ref": "#/$defs/displayName"
        },
        "model": {
          "$ref": "#/$defs/id"
        },
        "review": {
          "enum": ["manual", "policy"]
        },
        "documentationPolicy": {
          "$ref": "#/$defs/documentationPolicy"
        },
        "steps": {
          "type": "array",
          "minItems": 1,
          "items": {
            "oneOf": [
              {"$ref": "#/$defs/codeStep"},
              {"$ref": "#/$defs/buildStep"},
              {"$ref": "#/$defs/verifyStep"},
              {"$ref": "#/$defs/noopStep"}
            ]
          }
        }
      }
    },
    "codeStep": {
      "oneOf": [
        {"$ref": "#/$defs/autonomousCodeStep"},
        {"$ref": "#/$defs/manualHandoffCodeStep"},
        {"$ref": "#/$defs/supervisedBlackBoxCodeStep"}
      ]
    },
    "autonomousCodeStep": {
      "type": "object",
      "additionalProperties": false,
      "required": ["id", "kind"],
      "properties": {
        "id": {
          "$ref": "#/$defs/id"
        },
        "kind": {
          "const": "code"
        },
        "model": {
          "$ref": "#/$defs/id"
        },
        "execution": {
          "const": "autonomous",
          "default": "autonomous"
        },
        "components": {
          "$ref": "#/$defs/idList"
        },
        "languageScopes": {
          "$ref": "#/$defs/idList"
        },
        "targets": {
          "$ref": "#/$defs/idList"
        }
      }
    },
    "manualHandoffCodeStep": {
      "type": "object",
      "additionalProperties": false,
      "required": ["id", "kind", "execution", "handoffPolicy"],
      "properties": {
        "id": {
          "$ref": "#/$defs/id"
        },
        "kind": {
          "const": "code"
        },
        "model": {
          "$ref": "#/$defs/id"
        },
        "execution": {
          "const": "manual-handoff"
        },
        "components": {
          "$ref": "#/$defs/idList"
        },
        "languageScopes": {
          "$ref": "#/$defs/idList"
        },
        "targets": {
          "$ref": "#/$defs/idList"
        },
        "handoffPolicy": {
          "$ref": "#/$defs/handoffPolicy"
        }
      }
    },
    "supervisedBlackBoxCodeStep": {
      "type": "object",
      "additionalProperties": false,
      "required": ["id", "kind", "execution", "handoffPolicy"],
      "properties": {
        "id": {
          "$ref": "#/$defs/id"
        },
        "kind": {
          "const": "code"
        },
        "model": {
          "$ref": "#/$defs/id"
        },
        "execution": {
          "const": "supervised-black-box"
        },
        "components": {
          "$ref": "#/$defs/idList"
        },
        "languageScopes": {
          "$ref": "#/$defs/idList"
        },
        "targets": {
          "$ref": "#/$defs/idList"
        },
        "handoffPolicy": {
          "$ref": "#/$defs/handoffPolicy"
        }
      }
    },
    "handoffPolicy": {
      "type": "object",
      "additionalProperties": false,
      "required": ["allowedTargets", "inputPolicy", "handoffTimeoutMs", "returnActions", "hooksAfterReturn"],
      "properties": {
        "allowedTargets": {
          "$ref": "#/$defs/idList"
        },
        "inputPolicy": {
          "enum": ["structured", "secret-direct"]
        },
        "handoffTimeoutMs": {
          "type": "integer",
          "minimum": 1
        },
        "returnActions": {
          "type": "array",
          "minItems": 1,
          "uniqueItems": true,
          "items": {
            "enum": ["complete", "abort", "request-agent"]
          }
        },
        "hooksAfterReturn": {
          "$ref": "#/$defs/idList"
        }
      }
    },
    "buildStep": {
      "type": "object",
      "additionalProperties": false,
      "required": ["id", "kind", "hooks"],
      "properties": {
        "id": {
          "$ref": "#/$defs/id"
        },
        "kind": {
          "const": "build"
        },
        "hooks": {
          "$ref": "#/$defs/idList"
        },
        "components": {
          "$ref": "#/$defs/idList"
        },
        "languageScopes": {
          "$ref": "#/$defs/idList"
        },
        "targets": {
          "$ref": "#/$defs/idList"
        },
        "order": {
          "enum": ["declared", "dependency"],
          "default": "declared"
        }
      }
    },
    "verifyStep": {
      "type": "object",
      "additionalProperties": false,
      "required": ["id", "kind", "hooks"],
      "properties": {
        "id": {
          "$ref": "#/$defs/id"
        },
        "kind": {
          "const": "verify"
        },
        "hooks": {
          "$ref": "#/$defs/idList"
        },
        "components": {
          "$ref": "#/$defs/idList"
        },
        "languageScopes": {
          "$ref": "#/$defs/idList"
        },
        "targets": {
          "$ref": "#/$defs/idList"
        },
        "order": {
          "enum": ["declared", "dependency"],
          "default": "declared"
        }
      }
    },
    "noopStep": {
      "type": "object",
      "additionalProperties": false,
      "required": ["id", "kind", "reason"],
      "properties": {
        "id": {
          "$ref": "#/$defs/id"
        },
        "kind": {
          "const": "noop"
        },
        "reason": {
          "type": "string",
          "minLength": 1,
          "maxLength": 1024
        }
      }
    }
  }
}